{
  "$schema": "http://json-schema.org/draft-07/schema#",
  "$id": "resume-data.schema.json",
  "title": "ResumeData",
  "description": "Schema for resume data structure",
  "type": "object",
  "required": ["personal", "about", "experience", "skills", "education", "contacts"],
  "properties": {
    "personal": {
      "type": "object",
      "required": ["name", "title", "location"],
      "properties": {
        "name": {
          "type": "string",
          "description": "Full name"
        },
        "title": {
          "type": "string",
          "description": "Professional title"
        },
        "location": {
          "type": "string",
          "description": "City, Country"
        },
        "photo": {
          "type": "string",
          "description": "URL or path to photo"
        }
      }
    },
    "about": {
      "type": "string",
      "description": "Professional summary"
    },
    "experience": {
      "type": "array",
      "items": {
        "type": "object",
        "required": ["company", "role", "period"],
        "properties": {
          "company": {
            "type": "string"
          },
          "role": {
            "type": "string"
          },
          "period": {
            "type": "string",
            "description": "e.g., 'Jan 2020 - Present'"
          },
          "location": {
            "type": "string"
          },
          "achievements": {
            "type": "array",
            "items": {
              "type": "string"
            }
          }
        }
      }
    },
    "skills": {
      "type": "array",
      "items": {
        "type": "object",
        "required": ["category", "items"],
        "properties": {
          "category": {
            "type": "string",
            "description": "Skill category name"
          },
          "items": {
            "type": "array",
            "items": {
              "type": "string"
            }
          }
        }
      }
    },
    "education": {
      "type": "array",
      "items": {
        "type": "object",
        "required": ["institution", "degree", "period"],
        "properties": {
          "institution": {
            "type": "string"
          },
          "degree": {
            "type": "string"
          },
          "period": {
            "type": "string"
          },
          "location": {
            "type": "string"
          }
        }
      }
    },
    "contacts": {
      "type": "object",
      "required": ["email"],
      "properties": {
        "email": {
          "type": "string",
          "format": "email"
        },
        "phone": {
          "type": "string"
        },
        "linkedin": {
          "type": "string",
          "format": "uri"
        },
        "github": {
          "type": "string",
          "format": "uri"
        },
        "website": {
          "type": "string",
          "format": "uri"
        }
      }
    }
  }
}
